Subject #,Photo 1 - Label ,Photo 1 - Explanation ,Photo 2 - Label,Photo 2 - Explanation ,Photo 3 - Label,Photo 3 - Explanation ,Photo 4 - Label,Photo 4 - Explanation ,Photo 5 - Label,Photo 5 - Explanation ,Similar ,Similar why ,Any ,Any Why ,Additional info ,,28,Yes,There are two roads connecting in a perpendicular fashion. A crossroad is when two roads intersect. A cross road also has a stop sign at the intersecting spot.,Yes,In the distance of the picture two railroads cross each other at about a 90 degree angle and continue on.,Yes,There are two intersecting roads in this picture. A stop sign is at the intersection. It is clearly seen that there is two roads crossing each other.,Yes,The sign post has two streets. The two one-way signs determine that the roads cross at a 90 degree angle.,Yes,There are 3 sets of lights. The red lights indicate that traffic should stop from one of the roads. The green signs say that there are two roads. They cross at a 90 degree angle.,Agree,I think I was able to provide enough of an explanation to determine whether similar images are also crossroads.,Neutral,It is difficult to tell whether a computer would be able to use my information to determine the concept of crossroads in any picture. I am not confident that I explained well enough.,A crossroads is always two or more roads that intersect.,,29,Yes,One street crosses another street and there is a stop sign for traffic not to enter the street because cars could be driving in a different direction.,No,There is not a street that crosses over another street and these are trains and not cars.,Yes,One street crosses over another street and there is a stop sign to stop traffic from entering the street when cars are moving in another direction.,Yes,There is a street sign with the names of different streets which indicate that the sign is on the corner of two different streets.,Yes,One street crosses over another street and there is a traffic light to stop cars from entering into the cross section when cars are traveling in another direction.,Agree,I taught some of the attributes necessary to indicate a crossroad.,Agree,It will know to look for these attributes in the images in the future to indicate a crossroad.,Nothing I can think of.,,30,Yes,"There is a street that goes left to right, and a street that goes into the picture, behind the stop sign. A street sign facing a different way than the street also implies that there is a crossroad.",No,"The rails do not cross, but rather meets and merges, or one runs above one another. It's not crossing because there are only 3 way directions where the rails are going, rather than 4.",Yes,"There is a street going bottom left to top right of the picture, and another street that goes from bottom right to top left. There is four curved corners of the sidewalk in the picture, which implies a crossroad.",Yes,The street signs imply that there are two streets crossing under it. The signs are facing different ways. The lights in the yellow boxes for the pedestrians are facing different directions too.,Yes,"There are street signs that are facing different directions, which imply a crossroad. The street lights and signals are facing different directions too.",Agree,"If there are street signs or lights in the picture, I think the computer can tell if there is a crossroad. I'm not sure how well a computer can tell which directions the streets are going without signs.",Agree,"As long as it can differentiate streets from other background images, I think it can tell if there are different directions of the streets in the picture. I think it can tell street signs and the way it's facing too.","If the road is crowded with cars or people, I'm not sure if it can tell that it is a road.",,31,Yes,"I believe this is a crossroad because there is a stop sight which tells cars to stop and check both left and right directions to see if traffic is coming. Just light a stop light, a stop sign indicates that there is traffic going across the path of the oncoming traffic. I can also see a road laying perpendicular to the direction the camera is facing.",No,"While there is more than one path here, neither of them intersect each other. The run alongside one another so, by definition, they are not a crossroad. To be a crossroad they would have to cross one another.",Yes,"There are two roads which cross one another, so it is a crossroad. By definition, the two roads intersect one another. You can also tell by the stop sign which indicates that one roads traffic needs to stop to make sure that crossing traffic doesn't crash into it. The stop sign tells each side to wait and take turns going while one side waits.",No,"There are no roads at all within view of the photo. While there are road signs that indicate there may be a crossroad, we can't see it in the photo. In order to say for certain that there is a crossroad, one would have to see that there were roads and that they intersected each other. The sings don't mean for sure that there is a crossroad because sometimes street signs just mark a part of the landscape that isn't really a road.",Yes,"I can tell that there is a crossroad here because there are two roads that intersect each other. I can see that there are two roads making an a cross shape if looked at from above. Even though it's dark, I looked at the street lights which tell me that there is one road with a green light crossing another with a red light.",Agree,I defined what a crossroad is. In each picture I tried to repeat the definition and illustrate why the parts of the photo fit that definition. In the photos without crossroads I explained why they weren't there.,Agree,I think future images can be compared to the definition and to the clues I gave.,I think that's pretty much it. Maybe another way to define the crossroad would be also to say that there have to be two roads which are not perpendicular in addition to crossing each other at some point.,,32,Yes,Two streets are intersecting and cross paths. A stop sign is present to help with the flow of traffic.,No,The railways do not contradict each other and the flow of traffic is not in conflict of each other.,Yes,There are two streets that intersect that run into each other. A stop sign is needed to direct the flow of traffic.,Yes,There is a street sign that states there are two roads that are intersecting and that cross paths here.,Yes,There are two streets that intersect. A stop light is needed to control traffic. There are also street signs pointed in opposite directions.,Agree,I said that the roads have too intersect and traffic needs to be controlled.,Agree,I said that the roads have too intersect and traffic needs to be controlled.,none,,33,Yes,"there is a cross walk and even though you can't really see the full intersection, you know it is there.",No,this is a railway system.,Yes,shows an intersection and streets crossing. There are stop signs so cars know to stop and pedestrians can cross easily,Unsure,the picture is showing the signs for the crossroad but you can not exactly see the roads you will cross.,Yes,you see the intersection and parts you can see the crosswalk.,Agree,"i mentioned what to look for, signs, intersections, crosswalks.",Neutral,i taught what to look for in a crosswalk but perhaps it needs more information.,"maybe showing it more images, for example you can have a cross walk in the middle of a single road and that is not the same as crossroads. So i can see a computer getting confused",,34,Yes,The photo shows a road that crosses another road. The paths of travel are in different directions.,No,This image is not showing a crossroad. I does not show two roads crossing each other.,Yes,There are two roads that cross each other. The roads travel in different directions.,Yes,There are street signs perpendicular to each other and this indicates a place at which two streets cross each other.,Yes,There are two streets that cross each other. It is hard to see the road because of the lighting but the street signs confirm that there are two streets crossing each other.,Neutral,I am hesitant to imagine five examples are enough to teach a computer the nuances of noticing crossroads.,Neutral,Crossroads can be hard to identify and any future image is a lot to imagine it is capable of.,"A crossroad can be a road that joins two other main roads. A crossroads can be an intersection of more than two roads.  A crossroad can also be a point of important decision which would be harder to see in photos.",,35,Yes,"The stop signs on either side of the street are a indication that the intersection is a crossroads you can after a stop choose to go straight, right or left depending on your destination.",Yes,This is a train crossroads and you can tell by the x crossroad towards the back of the picture it allows trains to change their direction and go on a different set of tracks than they originally started off with.,Yes,The stop signs once again signify a crossroads where you have multiple directions that you can head after making the stop at the sign. While there are no street signs a stop sign is a good indicator of a crossroads.,Yes,The two street signs show to different streets which lets you know that this is a crossing or a crossroads.,Yes,The traffic signals and the green street signs above them is another indicator of a crossroads the traffic signals direct the flow of traffic so that you can decide safely in busier intersections what direction you need to head in.,Strongly Agree,I thoughly described what made the different pictures indicators of a crossroad.,Strongly Agree,I gave the computer enough clues of what to look for depending on the method of travel.,n/a,,36,Yes,There are four entryways that intersect in one area.,No,These are train tracks. Crossroads have to be on the street. There has to be 4 entryways or paths where they all intersect.,Yes,"There are 4 entryways for vehicles. It covers every way you can go or come from. The crossroad is the intersection between all four paths, where all the roads cross each other.",Unsure,It looks like more than 2 paths or streets are intersecting at one point.,Yes,This has four entryways for vehicles. The intersect at one point and all 4 roads connect here.,Agree,I gave definitive requirements of a crossroad,Agree,My requirements allow the computer to easily identify a crossroad.,None,,37,Yes,one road that crosses another as in an intersection were 2 roads come together at one point.,No,"there are no intersecting roads here, no 2 roads coming together shown.",Yes,"there are 2 roads that come to an intersection, where both roads meet, they cross each other.",No,"there are no roads shown here so there are no roads intersection...however there are signs that signify that there are crossroads, but the roads are not shown",Yes,an intersection of 2 roads that cross each other.,Agree,i explained specifically what the aspects of crossroads are and look like,Agree,i explained specifically what the aspects of crossroads are and look like,none,,38,Yes,There are two roads that cross each other in the middle. There are stop signs in the photo. The stop signs are opposite one another. There is a road that crosses between the two stop signs.,No,This photo is of train tracks. Trains are not considered to travel on crossroads. There are no streets in the photo. There is no streets crossing one another. There are no traffic lights in the photo.,Yes,There are roads in the photo. The are two streets that cross each other. There are stop signs in the photo. Each stop sign is facing opposite of one another. There is a road that crosses between the opposite facing stop signs.,Yes,There are signs in the photo. Each sign on the post in the photo are facing a different direction. There are signs that say one way. The one way signs are pointing in different directions.,Yes,There are roads in the photo. The roads make a cross in the middle. There are traffic lights in the photo. The traffic lights are on all four sides of the road.,Strongly Agree,I feel that I have given the computer enough information to distinguish between whether a photo contains a crossword or not based upon streets being in the photo and whether those streets cross one another or not.,Strongly Agree,"Every image that has crossroads contains a road. If there are traffic lights opposite one another or stop signs opposite one another, and a road crosses between them, then the computer should automatically know that it is a crossroad.",I don't believe anything additional can be taught to the computer. The computer should be able to distinguish between crossroads.,,39,Yes,"This image shows two different streets. they are crossing over one another,in an intersections, so there is a crossroads here. Actually, there are several,because there are several different ways use can go. However, this is still a crossroads.",Yes,"A crossroad is two intersecting paths. It can also be metaphorical-when a person comes to two paths and must choose. This picture shows a train coming across two different tracks,and it must choose which one.",Yes,"This is a crossroads. There are two different streets clearly intersecting one another. You can go any of the ways,or cross over to another street.",Yes,"This shows two streets intersecting-Broadway and Spring St. These two roads cross over one another, as shown by the sign stating that there is a corner where they cross there. So they are a crossroads. Generally, if there are two street signs in a cross, you can tell the two streets cross.",Yes,"Although you can't tell what the signs say, it is obvious that there are several streets intersecting. You can further tell this by the direction of the cars-they are coming one way, but in the distance,they are going another. Because there are mutliple options and multiple roads, this is indeed a crossroads.",Strongly Agree,"Every image showed a crossroad. Also, the concept was easier than I realized, since it is just two streets crossing one another.",Strongly Agree,"If the only rule is two streets crossing, then I think the computer can easily learn that.","Honestly, railroad tracks might still be hard. And metaphorical crossroads might also be strange to it.",,40,Yes,"yes, one street is intersecting the other on the same level. this is a good example of a cross road. other vehicles, cars, or pedestrians could cross or impede your path as you travel down the street.",No,"there is no crossroad pictured here at all. the predominant feature are the rails. they might cross a road, but it wouldn't be a cross road because they aren't on the same level as the streets. for it to be considered a cross road, the intersection must happen at the same horizontal level.",Yes,there is an intersection point where one road crosses another. there is a road that runs through/across another road. cars people or other vehicles can go across your path as you travel down the road you are on.,No,"technically no. there is no crossroad pictured. the street signs are pictured. you might be at crossroad, but none is specifically visible from this perspective.",Yes,"its not a well lit example, but it fits the description. there is a point where two roads intersect on the same level, cars vehicles are people could cross the path of travellers down either of the roads.",Agree,I think there was enough examples and explanations to adequately describe a crossroad. Maybe a few more examples of what isn't a crossroad would help,Agree,"through the explanations, yes. I think it is relatively clear, however I don think a few more examples of what isn't a cross road would help contrast.","not sure. perhaps situations that only involve pedestrian paths, and not just roads for cars.",,41,Yes,Two roads coming and going in different directions converge together. The roads lead away and toward each other. The roads are flat.,No,These are train tracks and not roads. They are above the surrounding ground unlike roads. They carry trains and not cars or other types of traffic.,Yes,These roads converge after coming and going in different directions. They cross one another and lead in different directions. They are on the ground and convey traffic in different directions. They are long and narrow.,Unsure,"The signs indicate a crossroad but the roads themselves are not shown, which would make it more difficult to explain. The signs could create confusion in identifying crossroads.",Yes,Two roads coming and going in different directions are visible. They are flat and carry traffic/cars. They are designed to move traffic on the ground.,Disagree,"It was difficult describing a road other than flat and conveying traffic, a description a computer could likely not understand.",Disagree,The descriptions were not thorough enough to identify what a crossroad looks like.,I could have mentioned angles on the road as being perpendicular to one another.,,42,Yes,This could be considered a crossroad because the two roads intersect each other.,No,"A crossroad means that two images have to cross each other. Like a t or a + they have to intersect. These roads just split, they do not cross.",Yes,This is clearly a crossroad because you can see that it looks like a plus symbol +. Not all crossroads look like a plus but this one does and the roads intersect with each other.,No,I see now crossroad. Something can intersect but it has to be a road. You can imagine that there is a road that intersects but we don't know for sure.,Yes,It is dark but if you loo carefully you can see that the roads intersect each other and look like a plus sign.,Agree,I think that if they know it needs to intersect then they will get it.,Neutral,It was a hard one. I can't be sure that they can get this anytime.,People can also say crossroads in a metaphorical term and there is no road. Only one in their head.,,43,Yes,Yes the sign is in the set,Yes,Yes the image is crossroad .,Yes,Yes the the image is crossroad because the sign is in the set.,Yes,Yes this image have so many sign.,No,No the image is not crossroad because there is no sign is in the set.,Disagree,The future images is not similar,Disagree,The future images is not similar .,No additional information.,,44,Yes,The picture shows two streets that intersect with each other.,No,This is a train rail or a rail road. The rails in the picture do not cross.,Yes,The picture has two streets that cross each other in it. I guess that's a crossroad.,No,"The picture is of a pole with two street signs showing that Broadway and Spring St meet. However, the streets don't completely cross each other, so I think that's just an intersection rather than a crossroad.",Yes,"The picture is of an intersection, which is where one street crosses another. I think that's technically a crossroad.",Neutral,"I'm not 100% sure that I completely understand the concept of a ""crossroad,"" so I'm not sure how well I taught it to the computer.",Disagree,I bet I'm wrong about the definition of crossroads and if I am then the computer couldn't understand it.,"I do not know because I'm not too clear of the exact definition of ""crossroads.""",,45,Yes,I can clearly see asphalt streets crossing one another.,No,"Well, there is no road on the picture. There are rails and yes, they are crossing, but it's not a crossroad.",Yes,Clearly visible two asphalt streets crossing each other. Stop signs on all sides of the crossing.,Yes,"There is a clear sign showing two arrows with ""one way"" information on both - meaning there are two streets crossing each other.",Yes,"I can clearly see two streets crossing each other, as well as the traffic lights above the crossing.",Agree,"Pictures were simple to understand and see the crossings, or describe it as NOT a crossing.",Disagree,This was a tricky one. Not sure if that can be easily explained to a machine.,"It's worth mentioning the metaphorical sens of being on ""crossroads"" with choices and decisions. Not sure how to explain that to a computer.",,46,Yes,There is a stop sign to stop the traffic so the traffic in the opposite direction can move,No,this is not a road or crossroads. There are tracks with trains running on the tracks above the road.,Yes,the two streets are going in opposite directions. the two roads meet.,Yes,the signs have different names and the (one way) signs and street lights are pointed in different directions.,Yes,There is a main road intersecting with another road. I can tell because the roads join together in the middle and the traffic lights are pointing in opposite directions with the traffic lights different colors for different roads.,Neutral,I explained as best I could.,Agree,I tried my best to explain a crossroad.,none,,47,Yes,"There is just a perpendicular road here, not a cross road. You can move form one road to another, but you have to make it down the first rather than choosing to start one.",No,"Two roads cross over one another, but it is not a crossroad per se. There is no option to take a separate road if you are already on one.",Yes,"You can choose to go left, right or forward based on your direction. This would be considered a crossroad because one path splits into two.",Yes,"This is a road that splits into two streets, it is a cross road.",Yes,"There are two roads you can choose from coming from a third section, which is the sidewalk.",Agree,I think I have covered every aspect of a cross road.,Agree,"There aren't too many rules to follow, I think it can differentiate with my information.",I can't think of anything.,,48,Yes,Roads cross,No,It's a railroad track,Yes,Roads cross,Yes,Roads cross,Yes,Roads cross,Agree,Easy to define,Agree,Roads cross or they don't,Definition of crossroads,,49,Yes,"This is a crossroad because pictured here, is the crossing or intersecting of two streets.",No,This does not represent a cross road. This is a spot where trains come together.,Yes,This is a crossroad. Two streets intersect or cross making it a crossroad.,Yes,"This is a crossroad. Even though the intersecting streets cannot be seen, the two street signs ""Broadway"" and ""Spring St"" also represent the intersecting or crossing of two streets.",Yes,This is a crossroad. A crossroad is a point where two streets intersect.,Strongly Agree,A crossroad is something that is tangible and observable.,Strongly Agree,If the computer should easily be able to determine whether or not two streets cross.,Nothing,,50,Yes,I saw a street that led into another street at a perpendicular angle. One street opens into another street.,No,"I don't see one street running into another street at a perpendicular angle. Instead, I see railroad tracks.",Yes,One street crosses another street. This is a crossroad.,Yes,I saw a lamppost and saw two street signs at 90-degree angles.,Yes,"One street crosses another street. Also, there is a traffic light.",Agree,There was little ambiguity in the photos. So I was able to describe them better.,Agree,There was little ambiguity in the photos. So I was able to describe them better than eating photos.,Maybe technical details used by traffic engineers?,,51,Yes,"I can tell there are two roads crossing one another creating a crossroad. the two roads on the left and right of the image disappear but they assuredly continue on. The viewpoint we are in tells me we are coming from a road, also the stop sign facing us. and we can clearly see the road in front for some distance.",No,These are not roads they are railroad tracks. I know this because I can see the rectangle shapes of trains that are on road-like tracks made of many planks of wood with steel silver rails on top,Yes,the straight lines that become rounded then turn in a 45 degree angle are sidewalk corners. They are built along side many roads. The dark surface is the road and we can see 3 roads very carefully. The fourth part of the crossroad which comes from the left bottom corner to the right side of the image disappears but cars park along side many roads and we can see they go downwards because of the hill. The street also go down and onward.,Yes,Without seeing the roads I know that these rectangles with lettering on them are street signs. They represent the roads. The lettering is the name of the roads and the ones with arrows tell the direction of traffic. Also the building in the image almost always are built along side roads.,Yes,the direction the red and green lights are facing tells me roads go on even out of the image. also the round whitish lights are on cars. Cars travel on roads and they are coming from one way and heading straight o the road lower left corner going offscreen.,Agree,I described the surroundings or roads and road colors.,Neutral,Roads are difficult. They are large and flat and may not be crossroads.,That somtimes there are roads that are parrelel and 3 and 5 way intersections.,,52,Yes,"This is an intersection. At an intersection, two streets cross each other which would make it a crossroad.",No,This is a picture of some train tracks. That means that there is no crossroad in this image.,Yes,There are two roads at this intersection meaning that there is a crossroad in this image.,Yes,There are street signs showing where two streets intersect. This shows that the roads cross each other.,Yes,"Although it's dark, you can see the street signs at the top showing that it is two different streets crossing each other. That means that it is a crossroad.",Agree,I explained about streets/roads crossing each other at an intersection.,Neutral,I can not say if the computer will be able to recognize it from any image.,I'm not sure.,,