Subject #,Photo 1 - Label ,Photo 1 - Explanation ,Photo 2 - Label,Photo 2 - Explanation ,Photo 3 - Label,Photo 3 - Explanation ,Photo 4 - Label,Photo 4 - Explanation ,Photo 5 - Label,Photo 5 - Explanation ,Similar ,Similar why ,Any ,Any Why ,Additional info ,25,Yes,"they men are sitting at a table with food in front of them on plates. one is grabbing food with a fork, and another appears to have a mouth full of food.",Yes,the horse is attempting to eat the item by licking it. Licking or otherwise putting something in your mouth constitutes eating.,Yes,"Food is on plates, and one person has some in their mouth. Licking or otherwise putting something in your mouth constitutes eating.",No,no one is actually physically putting food in their mouth. The photo shows cooking which one must generally do before eating.,No,the photo just shows food sitting on a plate. No one is touching it or attempting to put it in their mouth.,Agree,i described what constitutes eating,Agree,Licking or otherwise putting something in your mouth constitutes eating.,n/a,26,Yes,"human beings are using their hands to insert food into their mouths and chew it up. in the case of animals, they may be using whatever other appendages they have to eat. But with humans, they use hands. You can see the food there on their plates.",Yes,"this animal is eating with its mouth. it does not have hands, so it eats only with its mouth and teeth",Yes,beings are putting food into their mouths and chewing it up,No,"no animals or humans are putting food into their mouths, so it is not the act of eating.",No,"there are no beings here to eat the food. the food is here, but no one is eating it. that is why this is not the concept of eating. it is just food.",Strongly Agree,"i believe i covered every detail as to what the act of eating is, so it should be able to identify it.",Strongly Agree,"i explained every detail about eating, so it always knows what it is if it follows my guildelines",nothing that i can think of,27,Yes,"This is a group of people around a table eating. Forks in hand, food going up to mouth. Some are chewing.",Yes,"The horse is eating from the trough, and there are horses in the background eating off the floor, probably grass. The main horse is licking something too.",Yes,"This picture shows people eating, and putting the food into their mouth to consume it.",No,This picture shows cooking not eating. They are preparing the food not yet eating it.,Yes,this is a piece of cake that is ready to be ate. so the concept of eating is here because they have the fork ready and everything.,Strongly Agree,I gave solid descriptions of what it should be.,Strongly Agree,The computer should be able to learn very well from my descriptions.,"Nothing, I feel like my examples explained it very well.",28,Yes,There are many people sitting around a table. They have food in front of them and have silverware in their hands and food on their plates.,Yes,Eating is a living thing consuming an object with its mouth. There is a horse licking a block. You can see its tongue on it.,Yes,There are people at a table. Food on the plates. One person is putting food in their mouth.,No,There is a personin the picture but it does not show anyone putting any food or any objects in their mouths.,No,There is food in the picture but there is nobody consuming it. Eating has to be a living thing putting food in its mouth.,Agree,Eating is an easy concept. It involves a living being consuming food.,Agree,It is easy to discern whether a living thing is consuming something.,Nothing.,29,Yes,"There are many people in this photo sitting at a table, with eating utensils in their hands to eat the food that is right in front of them.",Yes,The animal is licking the block which indicates that there is a flavor which it likes to eat. It wants to have the object in it's mouth.,Yes,There is food on the table and one person actually has the food in their mouth which indicates they are eating the food. They are in a restaurant which one goes to to eat food.,No,There is no food with people in front of it and no one is putting food into their mouths which would indicate eating.,No,There is food in the photo and a utensil which serves the purpose of eating but there is no one present to do the act of eating.,Agree,I taught it that there must be a person or animal present and there must be food in front of them which they will put into their mounths,Agree,I gave it the attributes of what indicators must be present for there to be the act of eating.,None,30,Yes,"There are food on the table with people facing it. Some people are also looking down at the food. People are holding utensils like forks, which is touching the food on the plates.",Unsure,"I don't think the horse is eating, because I don't think whatever he is licking is food. I have never seen anything like it, so I'm not sure.",Yes,There are food on the table with people facing the food. Someone has food up to her mouth and she has her mouth open. The other person is touching the food on her plate as well.,No,"There is food, but there are no people facing the food. No one is opening their mouth or chewing either. No one is touching the food.",No,"There is food on the table, but there is no person in the picture. So this is just a picture of a cake, but not someone eating the cake.",Strongly Agree,I think I defined a few conditions that needs to be met for the images to be considered someone eating.,Agree,"I think the conditions I listed, such as ""people must be facing the food"" are universal enough to work with any images to identify ""eating"".",There might be images where people would be eating but aren't facing the food on the table. Then it will have to look at how the food looks on the table (if it looks like it's been eaten) or if the person is chewing.,31,Yes,"The definition of the concept of eating has been satisfied because there are elements of eating. The main element present is food. There are also many dishes, glasses and eating utensils present. In addition, there are people actually eating in this photo.",Yes,"Although this is a different creature eating, it is still an example of the idea of eating. The horse is eating or licking a salt block. It's ingesting nutrients, which is also another way to define the concept of eating. The concept of eating can be defined as having any of the elements involved in the concept present such as eating, utensils, plates, or food.",Yes,"By definition this illustrates eating because it contains elements of the eating experience. Mainly, it contains food. But it also has plates and utensils which are used to eat food. There are also a number of dining tables which are present in restaurants which serve food.",Yes,"By definition, this illustrates the concept of eating. There is food waiting. And there are plates. Also, there seems to be a chef in the background. All of these are elements needed to define eating. In addition, this particular photo has heating lamps which are used to keep food warm in a restaurant while it waits to go out to the diners.",Yes,"This illustrates the concept of eating because it contains elements that are included in the idea of eating. There is a fork which is used to eat and there is an actual edible object, cake. There is also a plate which is used to hold the item to be eaten. By definition, the concept of eating should have either something to be eaten or objects involved in the process or both.",Agree,I tried to define exactly what eating consists of. I named the different elements.,Agree,"I just told it that to be considered eating it had to have certain elements present such as eating, food, utensils, plates, etc.",I can't think of anything else to add. I think I was pretty specific.,32,Yes,Human beings are putting food into their mouths at a dinning table. They are consuming food off of a plate,Unsure,This might or might not be considered eating given what is happening. A horse is licking a salt block.,Yes,"A person is biting off a piece of food from her hand. There is food on the plate, and a person is eating consuming it.",No,No body is putting food in their mouths nor is anybody consuming any food. There is just a kitchen.,No,"There are no humans in the picture. Nobody is putting the food in their mouths and no body is getting ready to consume the food. The food is just sitting there, there is no indication of consumption.",Agree,"Because I explained that in order for something to be considered eating, someone must be consuming food.",Agree,"Because I explained that in order for something to be considered eating, someone must be consuming food.",Whether or not licking food is considered eating or not.,33,Yes,"yes. people are sitting at the table, have food on their forks, in their hands, and even though it may not be in their mouth, that is where it is going.",Unsure,the donkey is clearly interested in it and has his mouth on it but i'm not sure what it is. could be something a donkey eats. looks like it.,Yes,people are sitting at a table and putting food in their mouths.,No,a picture of a restaurant preparing food is not eating. i actually don't see food in the picture.,No,its just a picture of cake. which is food but no one is buy it so i don't count it as eating.,Agree,i mean you are sitting at a table and there is food. people have to be present for eating to be done.,Agree,they can be confused seeing food but i think they know people have to be around.,i guess i may have confused the computer on the last image where they were preparing food in a kitchen,34,Yes,People are shown gathered with plates of food and they are located at a dining table.,Yes,The animal is consuming something with its mouth.,Yes,At least one person in this photo is putting food into their mouth.,No,A kitchen and food are shown but it is not showing that this food is being consumed.,No,Food is shown but the food is not being consumed.,Strongly Agree,It is clear whether or not eating is shown so similar images should be similar enough to be accartely identified.,Disagree,Eating can look different than just what has been show in these examples.,Chewing is also eating so the food may not be visible but chewing is.,35,Yes,There are people sitting at a table with plates of food in front of them. They have utensils in their hands to pick up the food to place it into their mouths.,No,There is no food in the picture for the horse to eat. It is licking a salt block instead of eating something which could be looked at as a form of drinking maybe but not eating.,Yes,There are plates of food on the table. There is a person holding a piece of food with the hands and they are biting it.,No,This isn't a concept of eating because the picture shows a kitchen where food is prepared. So the food isn't ready to be eaten just yet.,Unsure,While there is food and a fork in the picture there is no one present to eat the cake. So there is no way possible to know if the cake is about to be eaten or not.,Agree,I told the computer why I though there were certain pictures that showed eating vs it not showing by explaining what I was looking at to come up with that reason.,Agree,The information I provided will give the computer context clues to look at to determine more easily whether a scene shows eating or not.,I might could have an outdoor setting so that the computer doesn't think you have to sit at a table to be considered eating.,36,Yes,Several individuals are in the midst of the act of eating. They are putting utensils in their food and looking at their plates.Some have food in their mouths and are chewing.,Unsure,"I am unsure of eating, because I cannot identify the object the horse is licking. The tongue is out, but the item does not resemble food.",Yes,There is food on the table and one woman is seen with meat in her mouth. Another has meat in her hand and she has taken a bite out of it.,No,No one is before the food with a utensil filled with food entering their mouths. This woman is cooking an preparing food.,No,There is no human around the food. No one is putting any of the cake into their mouth.,Agree,"I explained why a picture was not eating and why it was in a definitive way. No human, no food entering the mouth or inside the mouth means that's not eating.",Agree,The computer will be able to base their answer on my qualifiers. If they see what I determined to be eating then they will mark it as so and the opposite as well.,"I think I should have taught the computer more about what signifies food, because I don't want the computer to think any object entering the mouth is indeed food.",37,Yes,"people are consuming food for nourishment and enjoyment, through their mouths that goes into their stomachs. the action is chewing food and swallowing it for nourishment",No,"this horse is not consuming something through the mouth for nourishment, so eating is not happening here.",Yes,"people are ingesting food into their bodies, through the mouth for nourishment and/or enjoyment",No,nothing is being consumed for the purpose of nourishment or enjoyment. there is no food being ingested,No,"there is food, but here is no one actually putting this food in their mouths to chew and swallow to show the action of ""eating""",Agree,"i was able to explain how ""eating"" happens and when",Agree,i fully explained all aspects of eating,none,38,Yes,There are plates on a table. There is food on the plates. There are humans sitting at the table. The humans have food on plates in front of them. At least one human has food in their hand or hands.,No,There is a horse in the photo. There is a place to eat from. There is no food in the eating place. The horse is licking a block. There is water in the place to eat. The horse is not chewing food.,Yes,There are plates on the table. There is food on the plates. There are humans sitting at the table. At least one human has food in their hand or hands.,No,There is a kitchen in the photo. There are plates in the photo. The plates have food on them. There is a human in the photo. The human does not have food in their hand or hands.,No,There is a plate in the photo. There is food on the plate. There are not any humans in the photo. There are not any humans with food in their hands.,Agree,I believe I have taught the computer to identify humans eating positively. There are not enough photos of other animals to thoroughly teach the computer to identify animals eating. There is enough information taught to the computer to possibly decipher this with animals.,Agree,I believe I have taught the computer enough to identify all future images of humans eating. I would like to teach more about animals eating as well. I don't think there is enough information from one picture of a horse to allow the computer to decipher animals eating.,I would have taught the computer to identify animals eating by having food in their mouths and chewing that food.,39,Yes,"This photo shows a group of service members at a restaurant. They are surrounded by food and putting it into their mouths, so they are eating the food. They also have a lot of forks around them, which lets them put the food into their mouths and eat it. Many people can get together to eat food-it can also be a large celebration.",Yes,"In this photo, a pony is licking something that looks like food. Not all animals eat like humans do. Animals like ponies can lick at something to get nutrients, so that is a different form of eating. Because the pony is putting it into his mouth and ingesting it, this is a form of eating.",Yes,"This photo shows several plates of food in what looks like a restaurant. There are two girls putting food into their mouths and eating it. There are utensils sitting out as well, giving people options to eat with. They are also using their hands,since those also help with eating.",Yes,"This image shows what looks like a chef or cook preparing food and setting it on plates behind her. We put food on plates before eating it,so this is close to the concept of eating. However, no one is actually doing the act of putting food into their mouths, so it only suggest the fact that this food will be eaten by someone.",Yes,"Although no on is directly putting the cake into their mouths, the photo shows a picture of a cake and a fork. Because there is food on the plate,and a utensil with which to eat the food, this photo suggests the concept of eating. A person will probably grab the plate with its fork and be able to eat the cake.",Strongly Agree,"I think I explained that if there is food and utensils, there can be people eating.",Agree,"I feel like I covered most things, though it was hard to explain or think if there was a difference between just food and people actively eating it.",Not that I can think of.,40,Yes,"there are a bunch of uniformed men having dinner. they in the process of eating the food on their plates. they could be in a cafeteria or restaurant, or just a dinner table.",Yes,"there is a horse or a colt who is nibbling on something. its borderline, but I think I would put this into the category of eating because the colt is ingesting something with its mouth",Yes,"there is food at a dinner table and someone is directly putting food from their plate into their mouth. this is definitely a good example of eating. they are at a restaurant having dinner, so this is also a familiar context for eating.",Unsure,"there is food and there is cooking. there is a chef cooking food in the back and there is food under heat lamps. people will be eating soon, but there isn't anyone eating in these photos as of yet.",No,"there is a piece of cake here, and it could be eaten, however no one is eating it. the cake is just sitting there. no eating is happening.no person or animal is present to eat the cake at the moment.",Neutral,"except for possibly the first example, i think i described what the elements to eating are. it consists of people or animals putting food in their mouth to ingest it. however I feel like it would take more pictures or scenarios to really make it consistent",Neutral,"I feel like there need to be more examples to work through, more of both eating and not-eating examples so its made really clear","eating isn't just putting food in your mouth, its also about chewing and swallowing for sustenance. for example someone brushing their teeth might be confused with eating, so that is something that needs to be delineated.",41,Yes,People have plates of food in front of them on a table and are holding eating utensils. They are seated in a way that is best for eating.,Yes,An animal is in the picture licking/eating a salt lick. The animal's tongue can clearly be seen licking the food source.,Yes,People are seated at a table with plates of food in front of them. They are placing food into their mouths. from the plates. Their actions indicate eating. There are forks and spoons on the plates to eat with.,No,There is no one in the image near the plates eating. No one is near the food so eating is not taking place.,Unsure,There is a plate with cake on it and a fork but no one is in the picture to show that there is eating taking place. Eating requires a person to be in the picture in the process of eating. No person means no eating of food.,Neutral,"It is a concept that is very difficult to explain in an accurately descriptive way, but clues were given by having people and plates of food and eating utensils in the image.",Disagree,"It's a difficult concept to explain to a computer, likely requiring some better clues as to what eating involves.","The position and location of the image, the context of it.",42,Yes,There is a table. People have food in front of them. They have forks and spoons. They are putting the food in their mouths.,No,"I wouldn't call this eating because it looks like the horse is drinking. It looks like liquid and you don't eat liquid, you drink it. There is no food there.",Yes,There are plates with food and people are using their hands and utensils to eat the food. One person even has the food right in her mouth.,No,"This would be cooking. This is getting food ready for people to eat it later. There is a chef, who prepares the food. Then the food will be put on the plates. From there it is taken to the people who will then eat it and be eating. But this is not eating, this is cooking.",No,"There is food but there is no one to eat the food that we can see. They might eat it later but they aren't eating it now. They might have eaten it in the past but they are not ""eating"" right now. There is no mouth chewing food.",Agree,I told them what it takes to be eating and what is not eating.,Agree,"I think that as long as they know that you have to have it in or on the way to your mouth, then they will get it.",none that I can think of,43,Yes,Joint working dinner for different men.,Unsure,This horse eat to live.,Yes,Some Friends eat dinner together.,Yes,Work in the restaurant for life.,Unsure,Some Special Cake and the taste is great ..,Neutral,Maybe i did it well or not.,Neutral,Maybe i taught the computer to identify whether or not .,No additional information.,44,Yes,The group of people appear to be sitting in a restaurant. They all have plates of food in front of them. Some have forks in their hands and are digging into the food using the forks.,Unsure,"The main subject of the picture is a horse. The horse appears to be licking something. I do not know what that thing is. If it is a kind of food for horses, then I guess the horse is eating.",Yes,The people in the picture are in a restaurant. They have food in front of them. The two people have food in their hands. One of the people is putting the food in their mouth.,No,"The picture is of a restaurant kitchen and there is food in the picture. However, the only person in the picture is the chef and she is not facing the camera. It does not look like she is eating and I doubt she is. Her hands are down and to her side, so nothing is near her mouth.",No,"The picture is of a slice of cake, but that is all. No one is in the picture, therefore there is no eating.",Disagree,Can the computer understand completely what I was saying? I sort of doubt it.,Strongly Disagree,"There is probably a ton of ground I didn't cover in terms of pictures containing the concept of eating. Even if the computer understood what I was saying, I don't think that it would help completely.","I can't think of anything specific, but there's probably a lot of stuff. One thing I can think of is that most of the pictures that contained eating were set in restaurants, and eating isn't limited to restaurants.",45,Yes,"Again, a clear picture showing eating. Table with plenty of plates filled with food and men sitting and talking while eating and drinking. An event of some sort that include eating process.",Unsure,"I'm not sure what is that horse licking. If it's food, that that licking is a part of eating process, but it may be just cold, and the horse by licking it - cooling himself.",Yes,"Clear example of eating. We see a restaurant with many tables. People grabbing food from their plates and putting those in their mouths. More plates with food on them, ready to be eaten.",Unsure,"We can see kitchen and plates with something on it, but I'm not sure if that's after the eating and now they just cleaning everything, or the food is being served.",Yes,"There is not only a piece of pie that shows ""eating"" but also a plate and a fork that are used for eating - in this case, eating a pie.",Neutral,"There were clear ""eating"" symbols on some pictures, but some were unclear if it's showing what we were looking for.",Neutral,...sometimes the picture could mean more than one thing. It would be hard to explain that to a computer.,"How to explain phrase ""what's eating You"" ?",46,Yes,there are plates with food on them. The men are holding forks to pick up the food. They are sitting at a table and there are glasses for drinks that accompany eating. Salt and pepper shakers for the food.,Unsure,I'm not sure if the horse is eating or if the ramp is used for food.,Yes,there are plates with food on a table with people sitting around it. There are utensils such as a knife and fork on the plates that people use to eat the food with.,Yes,this is a kitchen where people prepare food.There are plates for food to be placed on them. There are stoves the back that prepare food and a man in white which is a uniform used in the kitchen while preparing food.,Yes,there is a piece of cake on a plate with a fork next to it.,Agree,I believe I described the photos of eating well,Agree,I explained as best I can.,none,47,Yes,This is a group of people eating food. There are at least two people visibly eating.,Yes,The horse is using it's tongue and mouth to lick and therefore eat.,Yes,There are two women eating at a restaurant.,No,"There is food being prepared, but nobody is actually eating anything. There isn't even any actual food in the picture.",No,"There is a piece of cake in the picture. This means there is food in the picture, but nobody is actually eating it.",Agree,"I might not have been descriptive enough, but there wasn't much to detail. I made the difference between food itself and actually eating it very clear though.",Neutral,I think it could differentiate from eating and food but i'm not sure if I was detailed enough for it to pick it out from another action.,Movement of mouth = food possibly? I'm not sure how to really teach it.,