Subject #,Photo 1 - Label ,Photo 1 - Explanation ,Photo 2 - Label,Photo 2 - Explanation ,Photo 3 - Label,Photo 3 - Explanation ,Photo 4 - Label,Photo 4 - Explanation ,Photo 5 - Label,Photo 5 - Explanation ,Similar ,Similar why ,Any ,Any Why ,Additional info ,71,Yes,,Yes,"The horse has his tongue out and is above a trough that usually contains food or drink. A mouth (in this case a tongue) that is ""working"" is a good hint--but only a hint--to understand that a person or animal is ""eating.""",Yes,There are two or three people sitting at a food table. We know it is a food table because food is sitting on plates on the table. Two of the people we see are using their hands to manipulate the food. The woman on the right of the photograph has food raised to her mouth and it eating the food. The woman on the left of the photograph is picking some food up off her plate in preparation for eating that food.,No,"There is no human that can be seen in this photograph who can actually be seen eating food. There is one person in this photograph, but she is facing away from the camera so we do not really know what she is doing, although she is probably preparing food because she is in a kitchen.",No,"Robot, what we have here is a plate with a piece of cake, a napkin, and a fork sitting on it. But no one is actually eating the cake yet.",Agree,"Because I sought to provide enough detail about the eating process for a Robot to be able to understand that process. I explained the use of hands and kitchen utensils in the eating process. I explained that food must be brought to the mouth for the action to be considered eating, and I sought to explain to the Robot when eating--in some circumstances--is *not* taking place.",Agree,"For the same reasons given in the text box above, to whit: Because I sought to provide enough detail about the eating process for a Robot to be able to understand that process. I explained the use of hands and kitchen utensils in the eating process. I explained that food must be brought to the mouth for the action to be considered eating, and I sought to explain to the Robot when eating--in some circumstances--is *not* taking place.","Teaching a Robot something like this is a bit like writing a survey (which I have done on a few occasions): you write a survey and then test it, and very often you do not get the ""type"" of answers from that test as you expected to get. That feedback allows the re-composition of the survey so that it returns results which are usable.   I suspect that teaching a Robot is much the same. So, given the instructions I provided the robot, I can't tell what the robot doesn't understand until I have some feedback from the robot, feedback which I have not had. So I can't answer this question with any degree of accuracy.",72,Yes,,Unsure,The donkey in this photo is at a trough that would be used to for feeding donkeys. The object in this photo is not food for donkeys. It is something they can lick but not consume.,Yes,This photo has humans at a table with food on plates. Humans are using forks and plates to eat the food.,No,This photo does not have food. There is a kitchen that is used to prepare food. But it does not have food shown nor is there a way to eat it.,Yes,This photo has a piece of cake and a fork. The fork is used to eat the cake. The cake is food for humans. Humans eat cake.,Agree,"I used four key objects that are needed for eating: Fork, table, plate and food. All four are needed to complete the concept of eating.",Agree,"The computer should be aware of the four key objects needed for the concept of eating. In future images, these objects all have to be present to identify the concept of eating.","The computer needs to understand what the objects are in the image, what is food and what action by human or animal required to identify eating concept.",73,Yes,,Yes,There is a horse licking a block of food. It may take awhile to consume the block but the horse is definitely eating the block.,Yes,There is a woman eating off of a plate in the image. She has the food to her mouth and is chewing the food.,Unsure,There are plates in a kitchen but there doesn't seem to be any food nearby that's ready to eat.,Yes,There is a piece of cake and a fork indicating that someone is about to eat this cake.,Strongly Agree,I felt I gave enough examples of how people eat.,Strongly Agree,I felt that people with food is a good indicator that they are eating.,To watch for food on plates and if people are eating the food from the plate.,74,Yes,,No,No food in the picture. the hourse is just licking at something it might think is food,Yes,People are putting foood into their mouth. They are actively removing food off their plates.,No,There is food preperatioon but no one actively engaged in putting food in their mouth. There are no customers at the counter,No,There is food but no one is touching it. The food is just sitting there on the plate.,Agree,I explained what eating was and how it works,Agree,I explained why just a pic of food didnt represent eating,nothing,75,Yes,,Unsure,"The horse appears to be drinking. Although the action is similar, eating involves food. If water is being consumed from the mouth it is drinking, and not eating. Eating tends to involve chewing. There is no chewing performed when drinking.",Yes,People are at a table with food on plates. Silverware (eating utensils) are present. One person is clearly eating with their hands by bringing solid good to their mouth and biting it to begin chewing.,No,"This is a kitchen where food is made, but there is no food being eaten. There is no food clearly visible, no people sitting, and no chairs.",No,"This is food that would be eaten, but there is no one present to eat it. Food is required for eating, but food is eaten by an organic lifeform.",Neutral,I feel like my descriptions were too vague even when describing everything I felt I could. It would be easier to describe with a motion component.,Strongly Disagree,"The way people eat, the foods they eat, and where they eat are very diverse. This was a very limited set of examples.",Various ways food is eaten. Different types of foods. Bowls. Ways people sit in different cultures. Different types of utensils. Ways people hold food with hands.,,,,,,,,,,,,,,,,,