Subject #,Photo 1 - Label ,Photo 1 - Explanation ,Photo 2 - Label,Photo 2 - Explanation ,Photo 3 - Label,Photo 3 - Explanation ,Photo 4 - Label,Photo 4 - Explanation ,Photo 5 - Label,Photo 5 - Explanation ,Similar ,Similar why ,Any ,Any Why ,Additional info ,,26,Yes,"there is a wooden table with multiple legs and objects sitting on it, next to a bed. this is a good example of a nightstand",Yes,a nightstand is a table with multiple legs that sits next to beds and has objects sitting on top of it.,Yes,there is a table next to the bed with multiple legs and objects sitting on it,No,there is no nightstand here because a nightstand must be beside a bed.,No,there is no bed in this picture. a nightstand must be sitting right beside a bed. otherwise it is not a nightstand.,Strongly Agree,i believe I have covered every aspect of what a nighstand is,Strongly Agree,I don't believe there are any angles that I have missed here. It should know what it needs to know,nothing that I can think of,,27,Yes,There are two nightstands in this picture on both sides of the bed. They have the lamps on them which is a common trait.,Yes,In between the two beds there i a nightstand with a drawer and light on top of it.,Yes,The table next to the bed is the nightstand. It even has a light on it like how nightstands usually do.,No,"This is a picture of a restaurant or catering place. There are no nightstands in this picture, just tables and chairs to eat at.",No,"This is a television and entertainment center, not a nightstand. A nightstand is a smaller table usually with drawers.",Strongly Agree,I gave solid examples of what a nightstand typically is and described it well.,Strongly Agree,My descriptions make it easy to tell what a nightstand is.,No I mentioned everything needed for it to understand what a nightstand is.,,28,Yes,There are 2 nightstands in this picture. A nightstand is a small table next to a bed which usually has a lamp and other small items. This photo includes two tables and two lamps.,Yes,A nightstand is a small table next to one or more beds.There is a nightstand between two beds. It has a lamp and other small items on it.,Yes,There is a nightstand in the picture. A nightstand usually is a small table next to a bed. It usually has a lamp and other small items on it which this image includes.,No,There is no bed in the picture. A nightstand is a table that is next to a bed. The tables in the pictures are part of a dining room.,No,There is no bed in the picture. A nightstand is next to a bed in a bedroom. The stands in the picture are part of an entertainment center.,Strongly Agree,A nightstand is easy to explain. It is an easy to spot item that has a specific location.,Strongly Agree,A nightstand is easy to explain. It has to be next to a bed and a bed is easy to discern.,None.,,29,Yes,"Again, there is a piece of furniture that is next to a bed that holds necessary items that need a steady surface while lying in bed such as a lamp and books.",Yes,There is a piece of furniture next to a bed that holds necessary items such as a lamp that you will use while lying in bed.,Yes,There is a piece of furniture that is next to a bed that holds a lamp and necessary items that need a steady surface while lying in bed.,No,A nightstand is usually not present in a public space and it is usually a piece of furniture that is next to a bed.,No,The piece of furniture is not next to a bed and does not contain objects needed to be reached while in bed.,Strongly Agree,It has learned that a nightstand must be next to a bed.,Agree,It will look for objects such as a bed and a lamp to indicate it is a nightstand.,That a nightstand can be used elsewhere in the home and not necessarily next to a bed but it would be out of place.,,30,Yes,"This is a bedroom, where you usually find nightstands. There is a nightstand, it has four legs, is short and has a lamp on it. It also has a small drawer.",Yes,"It's a bedroom where you usually find nightstands. There is a nightstand with a lamp on it. It has four legs, about the same height as the beds. It also has a drawer.",Yes,This is a bedroom. There is a small table next to the bed that is at the same height as the bed. It also has a lamp on it. So I can conclude that it's a nightstand.,No,"This is not a bedroom, where you usually see nightstands next to beds. There is nothing in the photo that looks like a nightstand. All you see on the floor are dining tables and chairs.",No,There is no bed in this picture. Anything that looks like a table is too high to be a nightstand (higher than a bed) and doesn't have a lamp on top.,Agree,"I think I gave a typical condition where you can find a nightstand, and what it needs to look like to be considered a nightstand.",Neutral,"If there was no reference material in the image, like a nightstand just by itself on a white backdrop, I don't know if the computer will recognize it.",It may not always have a lamp on it. Some nightstands don't have any drawer.,,31,Yes,"I used the fact that I know a nightstand is a small table by a bed used to hold objects. Usually the table is pretty small compared to say, a dining table. Many times the nightstand is just made big enough to hold small items that one might use while getting ready to fall asleep such as books, a glass of water, a watch that's been taken off, tissues, or other smaller items. Many times a nightstand already has a light on it used to illuminate things until sleep. It's usually used while falling asleep instead of an overhead light because it's close and can be easily turned off from bed.",Yes,I know there is a nightstand in the photo because I see a small table that is about the height of both beds and right next to them. The table is serving the function of a nightstand in that it is a table withing arm's reach of the bed so that it can be accessed without getting out of bed. The nightstand also has a double lamp which is another clue that it's a nightstand because the light can be easily turned off when one is ready to sleep.,Yes,"There is a very small table about the same height of and next to a bed. This is pretty much the definition of a nightstand. Also, the table has a lamp on it, usually on nightstands. The table is also small, another feature of most nightstands. It seems to be being used as a surface for things used at night such as a book for reading and the lamp which can be easily reached because it is right next to the bed so it's not necessary to get up to turn it off.",No,"I know there is no nightstand because there is not bed in the photo. That's the biggest clue. Also, the tables that are present are much bigger, about 4 feet or so in diameter, rather than maybe a foot or so wide like most nightstands. In addition, there aren't any lamps on any of the tables. While nightstands don't always have lamps, they often do. These tables are for eating as demonstrated by the glassware, utensils and napkins on the surfaces.",No,"There is no bed in so that is the biggest clue that there is no nightstand. Normally a nightstand is used , like the name indicates, by a bed for use at night. Also, there are no small, bed height tables in view. In addition, the surfaces in view are all more shelves than tables. They aren't within arms reach of a bed which is the function of a nightstand.",Agree,"I think I was pretty detailed in my descriptions of what a nightstand is. I tried to be specific in my description of a nightstand's function and what physically consists of. Also, in the photos where there were no nightstands, I tried to tell the computer why the furniture pieces in it were not the same.",Agree,I defined the constraints of what a nightstand has to be. I also explained it's function so future items can hopefully be compared to these.,"Hmmm, I don't know if it needs anymore. Possibly I might have mentioned that nightstands are often wood and only about a foot or so in surface area. Also, usually nightstands have four long legs and are often, but not always, square or oval to fit next to a bed.",,32,Yes,There is a stand next to a bed that holds a lamp. A stand or a small dresser next to a bed is considered a night stand.,Yes,There is a stand that is next to two beds that hold a phone and a clock. A stand next to a bed is always considered a night stand and only utilized during night time or a time in which you sleep.,Yes,There is a small stand to the left of the bed that holds a lamp and a couple books. A stand next to a bed is a night stand.,No,This is a dinning room and the tables are used for eating meals not for night time. A nightstand is usually next to a bed and used for such purposes.,No,There is no bed in the photo and these stands are not used in sleeping. These are regular entertainment stands and not nightstands.,Agree,I stated that a night stand needs to be next to a bed to be considered one.,Agree,I let the computer know that nightstands are only used when sleeping or around a bed.,none,,33,Yes,"Next to a bed, has a lamp on them and one has books. Perfect example!",Yes,"Its next to a bed, has a clock, telephone and a lamp on it. perfect example of a night stand.",Yes,Hard to see but we keep lamps on nightstands and they are usually placed next to a bed.,No,This is a restaurant. there are no nightstands at restaurants,No,this is next to a tv and its holding dvds. thats more of an entertainment stand.,Agree,Night stands are pretty easy to describe.,Agree,i think they learned it is found in a bedroom and it is next to a bed and the things people keep on it.,I can see how it might be easy to confuse a nightstand and an endtable which was not explained in the process,,34,Yes,There are actually two nightstands. They are beside the bed. They are small.,Yes,There is a small table and it is next to a bed.,Yes,There is a table that is next to a bed. It is a small table.,No,There is no nightstand as a nightstand is found near a bed.,No,There are no beds. There are no small tables.,Strongly Agree,The criteria is clear and simple to follow.,Agree,The criteria is pretty simple and nightstands should be easily identifiable.,none,,35,Yes,The two tables are on either side of a bed and they have lamps on them probably for reading this is a perfect example of what a nightstand would be.,Yes,The table is in between beds which means it is a nightstand.,Yes,The lamp sitting on the table next to the bed would be considered a night stand.,No,There is no bed in the photo and a nightstand is a bedroom accessory so the above picture doesn't display that.,No,A nightstand is a table that reside next to or near a bed this shows a tv stand rack.,Agree,Let the computer know what kind of furniture you need to see to determine a nightstand.,Agree,I let the computer know what to look for.,n/a,,36,Yes,"There are two nightstands in the picture, on both sides of the bed. They have lamps on top.",Yes,This is a bedroom and there is a nightstand in between the two beds. There is a lamp on top.,Yes,"There is a nightstand by the bed, and the lamp is on top of it. It is small and can't hold much.",No,A nightstand is bedroom furniture. A nightstand would not be in an eatery or restaurant. It is also something that is small and usually holds a lamp and a drawer or 2.,No,Nightstands are located in bedrooms. This is the living room and there is no nightstand in this room.,Agree,Yes. I made a huge distinction by saying a nightstand had to be located in a bedroom.,Agree,"I told of how sometimes there are drawers, it usually has a lamp on top and it's small.",None,,37,Yes,"yes, there are 2 nightstands. one on each side of the bed with lamps on them..one has books in them..they are tables next to the bed, so they are nightstands.",Yes,"This is a bedroom with beds. There is a table next to the bed for things like clocks or lights, or telephones. the key is that it is a table sitting next to a bed.",Yes,this is a bedroom with a bed. next to the bed is a table with a lam on it as well as a book. a nightstand is a table that sits next to a bed which is the case for this picture.,No,"A nightstand is a table that sits beside the bed in a home. this is a restaurant with tables for eating. a nightstand is used for putting things on like a glass of water, or an alarm clock for use during the night or early morning.",No,"a nightstand is a table that is used to put things on such as a glass or a clock. A nightstand is a table that sits next to a bed in a bedroom. This picture is of a living room with a book case and a stand to put a t.v. on, there is not bed here so there is no table next to a bed here.",Agree,because it is an easy concept and I was specific when describing a nightstand.,Agree,because I was very specific,nothing,,38,Yes,There is a bed in a room. The bed is in a bedroom. There is a table or tables beside the bed. The table or tables have a lamp or other objects on them.,Yes,There is a bed in the photo. The bed is in a bedroom. There is a table beside the bed. The table has a lamp or some other object on it.,Yes,There is a bed in the photo. The photo is of a bedroom. There is a lamp or other object on the table. The table is level with the bed or lower.,No,"There is no bed in the photo. This photo is not of a bedroom. There are tables in the photo, but they are not beside a bed. There are no lamps on the tables. There are objects on the table, but they are kitchen objects.",No,There is no bed in the photo. This photo is not of a bedroom. There is a television in the photo. Televisions are not placed on nightstands. There are no tables beside a bed.,Strongly Agree,I believe that the computer can identify similar images based on whether there is a bed or not in the photo. Then based on if the bed has a table beside it or not. The computer should then be able to decipher whether it is a nightstand or not.,Strongly Agree,The computer should be able to identify all nightstands from now on. This is based on a bed being in a bedroom with a table beside it that has a lamp or objects on it.,I believe the computer should be able to properly identify all nightstands now. There is nothing futher to teach the computer.,,39,Yes,"There is a nightstand on both sides of the bed. Both sides have a small table, one that has a lamp,and one that has a bookcase and a lamp. Both are small and contain some small things one might need when they are in bed without getting out of the bed. The tables are small enough to fit things without being in the way.",Yes,"There is a small table in between the beds that would be a nightstand. On it is a phone and alarm which can be reached from either bed. These are both useful especially within arms reach of a bed. The nightstand is still small enough to not be in the way, but people can put other objects on it they need before going to bed.",Yes,"On the one side of the photo, there is a small table with a light and book on it. A nightstand is usually a small table next to a bed, where a person can put objects that they need for the morning or before they fall asleep. The lamp and book suggests that this person reads before falling asleep, but they don't want to get up and turn off the overhead lights. So the nightstand lets them put the lamp and book close by",No,"There are no nightstands in this image. A nightstand is usually in a person's bedroom, for placing small objects and necessities for the night. This is a restaurant, packed with tables used for eating. There are wine glasses and napkins,which one doesn't need at night, usually.",No,"The object in the photo is a sort of table/stand, but it is large and not next to a bed. It is a TV stand,because its purpose is to hold a TV. This stand can't be reached from a bed,and it is too big to not be given a large space by itself. It has nothing one needs for bedtime,either.",Neutral,"I feel like the computer was getting confused between nightstand and other tables. I think I explained well enough, but I am not sure.",Neutral,The computer seemed to be having trouble with the nightstand vs table arguement,Not sure. I think just knowing the difference between a table by your bed and a table doing anything else.,,40,Yes,"yes in fact, there are two nightstands present on either side of the bed. these are small tables that are able to hold small personal items so that they are available to whoever may be sleeping in the bed.",Yes,a nightstand is a small bedside table for keeping personal items near you while you sleep. this small table next to the bed fits this description.,Yes,yes again there is a nightstand in this photo. there is a small table with a lamp on it that could hold small personal items and its right next to the bed. there is also a desk in the photo which shouldn't be confused with the nightstand.,No,these are tables in a restaurant. there is no bed present. these tables are for eating food in a dining setting. there is no table next to a bed,No,"this is not a nightstand. its isn't near a bed. it holds a tv and other electronics. this is a shelf or tv stand. a nightstand needs to be near a bed, and be a small table or shelf to hold personal items.",Agree,I think its a fairly straightforward checklist to follow. small table next to a bed that can hold personal items while someone sleeps,Agree,yes for most cases I think the computer would be able to evaluate if the necessary conditions were to be met to identify a small table next to a bed,one scenario that might be difficult to try to describe or have the computer identify a nightstand when it is just on its own. say you were purchasing a nightstand at a store. would need to help identify what makes something usable as a nightstand on its own.,,41,Yes,There are two nightstands near the head of the bed on each side. They are small wooden tables on which lamps are placed for easy access from the bed.,Yes,The nightstand is between the two beds. It is a small wooden table on which items are found that are convenient to reach for while lying in bed. A clock and a phone are the nightstand.,Yes,There is a nightstand on the left side of the bed. It is a small table on which a lamp sits. It is always found next to a bed.,No,This is a restaurant and not a bedroom where a nightstand would be found. It is the wrong location. A nightstand is next to a bed.,No,There is no bed where a nightstand would be next to. A night stand is next to a bed.,Agree,I explained where a nightstand would be found and a brief description of it.,Agree,"I explained where to look for a nightstand, next to a bed.",Make sure to say that it is always found at the head of the bed and may be on either side or there could also be one on each side of the bed.,,42,Yes,"Well, there is a bookshelf on one side and a night stand on the other. The bookshelf is not a nightstand. The nightstand usually has four legs, but not always. A night stand usually has a drawer. There is a lamp on it.",Yes,I looked to the left and right. I looked at the beds. Then beside the beds. I looked at the light and there is a phone on the stand and a clock radio. So that is a nightstand. There is a drawer. It is wooden.,Yes,"Well, I looked to the right and saw a desk. Then I looked to the left and saw a lamp. That is a good sign of a nightstand. Then there were books on it. Definitely a nightstand.",No,There is no nightstand. I looked and saw a bunch of tables. This is a restaurant. They don't usually have nightstands. Then I looked at what could be a nightstand but it is a fireplace. A fireplace can be used to display things on the mantle but it is not a nightstand.,No,I looked at the area. There is a tv. It is a living room. There are usually no nightstands here. Nightstands are usually by a bed. This could be a bedroom but these are shelves and not nightstands.,Agree,"I told the computer where you find nightstands, what they look like, where they would be, and what might be on them.",Neutral,Maybe. I don't know. That is a lot of images to consider but they might have a good enough idea in order to decide.,I think I covered it best I could.,,43,Unsure,This image is nightstand or not.,Yes,This image is very nightstand .,No,This the image is not nightstand .,No,The photo is not nightstand .,Unsure,Maybe this image is nightstand or not.,Disagree,The images is not similar.,Agree,The photo is nightstand or not.,No additional information.,,44,Yes,There's a bed in the picture and to either side there are small tables. Those are nightstands.,Yes,There is a table between the two beds and I would consider that to be a nightstand.,Yes,"A nightstand is a small table next to a bed. It usually comes in a pair. In this photo, there is a black nightstand on the left side of the bed (or the right side if you're in the bed).",No,"This is a restaurant. There are no beds in the photo, so there can't really be a nightstand in the photo either. If there was a nightstand, it would be pretty out of place.",No,"There's no bed in the picture. If there's no bed, there's probably not a nightstand.",Agree,I think that finding an object in a photo is easier than deciding if a photo shows a concept.,Agree,"If the computer can understand me, I think I gave it a pretty good rule for determining if there's a nightstand in a picture.","Well, I guess I missed out that you can have a photo of just a nightstand, so if the computer saw that it would not say that the picture had a nightstand in it. I guess I'd show the computer a picture of just a nightstand.",,45,Yes,"Yes, that is a good choice - we not only see nightstands but also nightstands lamps.",Yes,Yes. Computer is going in the right direction. We see nightstand next to a bed. Lamp on the nightstand is nicely dimmed.,Yes,It is a good example of nightstand. Old fashion bed with a nightstand next to it with lamp on it and gadgets used by people right before sleep - like book.,No,"This is a worst choice. I don't see anything that can be called ""nightstand"". There is a fireplace with things on it, but nightstand is usually a piece of furniture that looks like small desk next to a resting area like bed.",Unsure,I don't think this would be a good choice. Not sure if what we see is actually a nightstand. Looks too modern.,Agree,There was a potential to correctly explain what a nightstand is - to a computer.,Agree,I think I wrote useful clues for the computer to make better choices in the future.,no comments here,,46,Yes,"there are two nightstands, one on each side of the bed. Both have lamps on top of them. One is also being used as a bookshelf. I know these are night stands because they are next to the bed and have lamps so someone can see when it is dark.",Yes,"The nightstand is between the two beds. There are lights above it and it has an alarm clock and phone on it. It is brown in color and has one draw. Clue: nightstands usually have an alarm clock on top of the nightstand. :",Yes,tHE NIGHTSTAND IS AT THE CORNER OF THE ROOM NEXT TO THE BED. IT IS BROWN IN COLOR AND IT HAS A LAMP AND BOOKS RESTING ON THE TOP.,No,"Nightstands are found in bedrooms where people sleep. There is no nightstand in this photo because this is a dining room where people eat, not sleep.",No,"the information I used was the fact that this room has a large TV, entertainment center, and drums. This is not found in most bedrooms where a nightstand would be present.",Agree,I did my best. The only mistake I made was in the first two pictures I neglected to state why I felt it was a bedroom but my explanations should be clear enough to teach the computer.,Agree,I described the nightstands.,The only mistake I made was in the first two pictures I neglected to state why I felt it was a bedroom,,47,Yes,There is a small table next to the bed. This is referred to as a night stand.,Yes,There is a small desk in between these two beds. This has a lamp on it and is used for putting things on before bed.,Yes,There is a small desk next to this bed. This is a night stand.,No,"This is a dining hall, not a bedroom. Usually night stands are small desks that go next to a bed in a bedroom.",No,There is no bed or bedroom-like room. Night stands typically go in the bedroom. This is a living room.,Agree,I think I covered everything having to do with night stands. There is not much to describe overall.,Agree,"I think I made the difference between piece of furniture, coffee table and night stand.",I can't think of anything.,,48,Yes,There is a small table with legs near the bed. It has a lamp on it. It is a nightstand.,Yes,"There is a nightstand in the center that has a lamp, clock, and phone on it.",Yes,There is a small stand that has a lamp and books on it.,No,"These are chairs, tables, and a fireplace in a restaurant.",No,These desks hold entertainment products in the center of the room. A nightstand is a small table near a bed.,Agree,Defined a nightstand,Neutral,It can't see what a nightstand is exactly.,"Context of the picture (bed, etc)",,49,Yes,"A nightstand is usually wooden and sits next to the bed against a wall. A nightstand is 24-36 inches tall and lamps, cellphones, and other things are placed on top of them.",Yes,"People place household items on a nightstand like lamps, telephones, and clock/radios.",Yes,"Sometimes, a nightstand is small enough to fit into a tight corner. Notice how a lamp sits on top of it.",No,A nightstand is usually only located in a bedroom. They are normally not found in dining areas.,No,General living areas are not spaces where nightstands are found. Different storage management is needed for this room.,Agree,I thought I accurately described what a nightstand is and is not from the photos that were provided.,Agree,I taught the computer where a nightstand is located and what its general function serves.,One thing I failed to mention to the computer about nightstands is they some nightstands have drawers that open and close that are used to store smaller items like books or documents or other personal items.,,