Subject #,Photo 1 - Label ,Photo 1 - Explanation ,Photo 2 - Label,Photo 2 - Explanation ,Photo 3 - Label,Photo 3 - Explanation ,Photo 4 - Label,Photo 4 - Explanation ,Photo 5 - Label,Photo 5 - Explanation ,Similar ,Similar why ,Any ,Any Why ,Additional info ,,1,Yes,nightstands are normally placed next to a bed. located in a bedroom.,Yes,lamp and alarm clocks are often found on night stands,Yes,sitting next to a bed,No,This is a dining room. These are tables. They are to tall and large.,No,nightstands look like tables. sometimes include a drawer. not shelves.,Agree,gave it every bit of information I could provide,Agree,it was just 5 examples but cant think of anything better,i cant think of anything,,2,Yes,There are 2 nightstands. One on the left of the bed and one on the right. They are small brown tables.,Yes,The table between the 2 beds is a nightstand.,Yes,There a nightstand against the wall between the bed. it's a small table near the bed.,No,These are dining room tables. This is not a bedroom and there is no nightstand.,No,There are tables but they are not next to a bed. A nightstand is a table next to a bed.,Agree,I clearly explained that a nightstand is a table next to a bed.,Agree,I pointed out the requirements of what a nightstand is,i cant think of anything,,3,Yes,"The object to the right of the bed is a nightstand. I can't see the object to the left of the bed well enough to say whether it is or isn't The nightstand has four legs and is roughly the height of the bed. It has a small surface for holding in this case a lamp, or a book.",Yes,"The object under the lamps on the wall, between the beds, is a nightstand. It has four legs and a flat surface roughly equal to the height of the bed. It holds a phone and an alarm clock in this instance.",Yes,"The object next to the bed on the far wall is a nightstand. Again it is a roughly the same height as the bed, and is big enough to hold a lamp and a book, a pair of glasses, and a glass of water, not much more.",No,"This is a restaurant, and the furniture depicted is of tables and chairs. A nightstand is a kind of table, but it is typically lower to the ground, and typically placed beside a bed in a bedroom.",No,"Nightstands are typically found in bedrooms, at the side of beds. This is a media stand containing the tv and consoles, and a shelf contining dvds and games. But there is not short flat surface on legs situated near a bed.",Agree,"The concept nightstand has clear boundaries, and a definable setting.",Agree,"There are rules defining what a nightstand is, and the settings in which it's found. I'm reasonably confident that the computer could recognize them .","I'm sure there are ""outlier"" nightstands that are not reflected by the rules I provided, or nightstands in non-bedroom settings.",,4,Yes,There is a nightstand in this picture. The first indication that there is possibly a nightstand is the fact that this is a room that contains a bed. The end of the bed with pillows often has a nightstand on one or both sides of it.,Yes,"This image contains beds, so there is a good possibility that there is a nightstand. There is also a lamp, which is often found on top of a nightstand. Find the side of the bed that has pillows and there is often a nightstand with a lamp nearby.",Yes,"There is a bed in this image, which often suggests there is a nightstand. In this picture, the side of the bed with pillows has a nightstand on the side. Nightstands often have lamps on top of them.",No,Nightstands are most often found in a bedroom. Nightstands are wooden rectangular prisms that contain drawers to hod things. This scene shows tables and chairs which would not be found near a nightstand.,No,"There are racks or stands in this picture, but they are not nightstands. In order to identify a nightstand, a bed is the firsts thing you should look for. There is not a bed in this image. There appears to be a lamp at the top of one of the stands, but because there is not bed, this is not a nightstand.",Agree,"I chose tangible indicators to search for: a bed, an end with pillows, a lamp nearby. This is a good start for a search to identify a lamp.",Agree,The same logic as above. I gave specific items to look for in any picture.,I am fairly confident that I have set good ground rules for a search.,,5,Yes,"In this picture there are two nightstands, at the two sides of the bed, and there are lamps on top of them. This is the common position for the nightstands, and they can have small shelves like in this case or, more commonly, many, big shelves in which to put our stuff.",Yes,"There is a nightstand between the two beds. It's easily recognizable for its shape, position, and function (holding a lamp).",Yes,"There is a nightstand in the corner. It cannot be see clearly, but you understand from its position and from its use, holding a lamp, that this piece of furniture it's a nightstand.",No,"There is a fireplace and many chairs and tables, but no other pieces of furniture and no nightstands in this picture",No,"In this picture there are two bookshelves, one with square shelves and one with round ones, plus a TV stand. There is no nightstand",Strongly Agree,"Because I gave the computer all the useful indication about the shape, the position, and the function of the nightstands",Strongly Agree,The computer should be able now to recognize any nightstand it will see,"It would have been useful to see a nightstand next to a bookshelf to make a direct comparison, but the info I gave the computer should be enough anyway",,6,Yes,"On either side of the bed is a small table. The table has a small surface, a drawer, and four legs. It also holds a lamp, which nightstands often do.",Yes,"There is a small table between the two beds. This table is called a nightstand. Typical items a nightstand is used to hold are also present, in particular a clock and a lamp.",Yes,There is a small table beside the bed. It holds a lamp and a couple of books.,No,"These tables are large. They exist independent of a bed. They are in a dining room, not a bedroom. They hold items used for mealtimes, such as napkins, salt and pepper shakers, and cups of water.",No,"There are no little tables here, only shelves and large stands. This room has a television and a variety of entertainment devices such as video game consoles. This is not a bedroom. There is no bed.",Agree,"I think we've covered the basics of ""nightstand"" fairly thoroughly.",Agree,"We've covered context, what it's used for, and what it is.",I can't think of anything that's been left out.,,7,Yes,it is by the bed and a stand you use at night making it a nightstand when you normally sleep in your bed.,Yes,it is by two beds and a stand you use at night making it a nightstand,Yes,it is by the bed and a stand you use at night making it a nightstand,No,there are no beds or bedrooms in the above pic. it is a dining room where a nightstsand would not be kept.,No,this is a living room not a bedroom wherte nightstands are kkep,Strongly Agree,i told in greart detail what the object was and was not,Strongly Agree,the pc know what and where to look,i did not teach it that people can use nightstands other places,,8,Yes,"The photo contains two night stands. One nightstand is on the left of the bed and the other is on the right side of the bed. The room is a bedroom. A bed, chest and dresser are visible. A lamp sits on each nightstand. One nightstand appears to hold books. The other nightstand has a drawer.",Yes,A nightstand is usually next to a bed. It is a small table with or without a drawer. Items are often present on top of a nightstand. In this picture a nightstand is visible between the beds and below the lamps.,Yes,A small nightstand is partially visible behind the bed in the upper middle part of the photo. It has a small lamp and book on top. The room is a bedroom and a small table next to the bed is a nightstand.,No,There are tables and a fireplace mantle with items on it in this photo. Fireplace mantles are not nightstands. This photo does not contain a nightstand. The tables are covered with cloth and dishes. Dining room tables are not nightstands.,No,A nightstand is used in a bedroom. There are other types of stands. This picture contains a TV stand in an undetermined room. A TV stand is not a nightstand. A TV stand has a TV on top and may have other items on it.,Agree,"The shapes and sizes and visibility of a nightstand varied. I think the training tried to make clear a nightstand is in a bedroom, next to a bed. I gave it qualities, but those were not exhaustive. There could be other styles that are missed, even if somewhat similar.",Neutral,"The angles, determining if the location is a bedroom and whether the style differs a lot might keep the computer from recognizing a nightstand is in the picture. All 3 of the nightstands shown were different.","I think I described a few variations based on what was shown in three examples. I also contrasted it with other flat tables and a mantle that should be excluded. Maybe a longer list of tables that match the qualities of a nightstand need to be added to the training, like an end table.",,9,Yes,There are actually two nightstands beside the bed with lamps on them in the bedroom. That is what a nightstand is.,Yes,The table beside the beds is a night stand. It is in a bedroom and is a table beside a bed. That is the definition of a nightstand.,Yes,A table is by the bed with books and a lamp on it. That is what a night stand is.,No,"Nightstands are in bedrooms beside a bed. This is a dining room, not a bedroom and there are tables in here but no bed.",No,A nightstand is beside a bed in a bedroom. This is not a bedroom and there is no bed with tables beside it.,Strongly Agree,A nightstand is a table beside a bed in a bedroom. It is a clear description.,Strongly Agree,I gave a clear description of what a nightstand is.,"I don't think I missed anything, I gave a clear explanation.",,10,Yes,There is a table with a drawer next to a bed. This is obviously a bedroom.,Yes,"There is a table, with a drawer, between two beds. There is a lamp on the table in what is obviously a hotel room.",Yes,"There is a table, with a lamp on top, next to a bed.",No,This is a restaurant dining room. These tables are for eating. There are chairs and dishes. There are no beds in this room.,No,There is a television and entertainment system in a living room. There are instruments present and no beds.,Strongly Agree,Because I was able to demonstrate things that needed to be present to constitute a nightstand.,Agree,I was able to identify what was and was not a nightstand,more examples of what is not a nightstand,,11,Yes,they are near an bed. and have lights on them,Yes,"yes, there is a bedstand in between two beds",Yes,there is night stand near the bed and the window,No,"this is a restaurant, not a bed",No,this isn't even a bed. just a tv and shows,Agree,near the bed,Agree,this is a good sign of a bedstand even in future pictures,the idea of a stand.,,12,Yes,Both of the small tables on either side of the bed are nightstands.,Yes,The small table placed between the two beds is a nightstand.,Yes,"A nightstand is a small table placed beside a bed for people to place items on.So, the small table in the corner is a nightstand",No,"A nightstand is a small table placed beside a bed. There are no beds in this image, so the tables are not nightstands.",No,"The table is long and not next to a bed, so it is not a nightstand.",Agree,The computer should be able to distinguish if a small table is next to a bed.,Agree,All nightstands are small tables positioned beside a bed. The computer can identify this relationship.,Most nightstands have a light and a clock on them. Some also have a telephone.,,13,Yes,"The table next to the bed is called a nightstand. It is always placed next to the bed for a lamp or alarm clock to set on. It can also contain books, reading glasses, a drink.",Yes,The table in between the beds is a nightstand. It is next to two beds and has a lamp on it. It also contains a phone and clock.,Yes,There is a stand right next to the bed that hold a lamp and some book. This is a nightstand because it is right next to a bed.,No,This is a restaurant with dining tables. These table are for food. People sit at them to eat. Night stands are for bedtime.,No,"These table are part of an entertainment center, not a night stand. Night stands are next to beds. This has no beds in the picture. These table contain items to entertain people, like a tv, speakers, and gaming consoles.",Strongly Agree,A night stand was simple to define. I feel my explanations were very clear.,Strongly Agree,I think the computer will be able to tell because I gave good explanations of what a nightstand would look like.,Nightstands are usually small. Not big like dinner tables.,,14,Yes,"On one side of the bed there is a small bookcase, on the other side is a small table. Both count as nightstands because they both have surfaces to put objects on and are both next to a bed. They also both have lamps on them, which is a very strong clue.",Yes,"The small table between the two beds is clearly a nightstand. For starters, it's next to the beds. Second, it has a lamp and clock on it, which are both common objects for a nightstand to have.",Yes,"There is a small dark table next to the bed with a lamp and two books on it. The definition of a nightstand is a small table or surface next to a bed to put objects on, such as a lamp. Therefore, this picture has a nightstand in it.",No,"This photo of a restaurant has tables in it, but no beds. A nightstand is a small table or surface next to a bed; therefore there are no nightstands in this picture.",No,"This is a picture of an entertainment center. There is no bed in the picture and no small table next to it. In addition, neither set of shelves is short enough to be used as a nightstand. Therefore there are no nightstands in the picture.",Strongly Agree,"I clearly defined ""nightstand"" as a small table or other surface close to a bed, and gave other context clues such as the presence of lamps and clocks on said surface.",Strongly Agree,"I feel I did a satisfactory job of defining ""nightstand"" and giving other context clues.","I am unsure about the flexibility of the term ""nightstand,"" such that a short bookshelf may very well be a nightstand, but a taller one may not, even if it, too, has a clock and lamp on it.",,15,Yes,The small stand is next to a bed,Yes,there are beds next to the stand,Yes,there is a bed next to the stand,No,a night stand is a stand next to a bed. there is no bed in this picture,No,A night stand is a stand next to a bed. There is no bed in this picture.,Neutral,I don't believe computers can learn visual concepts,Neutral,I don't believe computers can learn visual concepts,I don't believe computers can learn visual concepts,,16,Yes,There are two nightstands in this picture. The are on the sides of the beds and have lamps on them.,Yes,This is a hotel room. the nightstand is the table between the beds with the lamp and the phone on it.,Yes,The nightstand is the table with the lamp on it next to the bed. It is to the left of the bed in this photo.,No,There is no nightstand in this photo because there is no bed in this picture. this is a picture of a restaurant.,No,This is an entertainment center and there also is no bed in the photo.,Agree,I think I set up that there needs to be a bed in the picture and there needs to be a table next to the bed.,Neutral,I think that it needs to be able to tag where a nightstand might be.,I would like to have the computer learn by more than just words.,,17,Yes,There are two nightstands in this picture. They are small tables close to the head of the bed on each side. Each nightstand has a lamp on it. The nightstands are a similar height as the bed.,Yes,"The picture is of a typical hotel room. There is a nightstand between the beds with a double lamp, clock and phone on it. It is a similar height as the beds. It is a small rectangular table right next to the beds.",Yes,There is a nightstand to the left of the bed near the headboard with a lamp and a few books on it. A night stand is usually a small square table right next to the bed that is a similar height to the bed and has a lamp or books on it.,No,This picture is not of a bedroom as there is no bed visible in it. There are many tables with tablecloths and glasses on them as well as many black chairs around the tables. This is a restaurant. Restaurants do not have nightstands. They are specific to bedrooms.,No,"A nightstand is next to a bed. In this picture, there is a TV but no bed. There shelves on either side of the TV. The one on the left has DVDs on it. The one on the right is a lamp and a shelf. Neither one of these qualify as a night stand. They are not right next to a bed.",Strongly Agree,I feel that I did a good job on each picture of describing what a nightstand is by where it is located and what it looks like as well as what types of items are on it.,Strongly Agree,I gave many details and feel that the computer would easily be able to find a nightstand with the descriptions that I gave.,I cannot think of anything else that I could have told the computer to understand the concept of nightstand.,,18,Yes,"A nightstand is a type of table, but it is a small table usually used only to keep a lamp and some small items close to the bed.",Yes,A nightstand is a piece of furniture place by the head of a bed.,Yes,"There is a small table in the corner. It has a reading lamp on it, which is very typical of a nightstand. The books on the table for reading in bed are also very typical items to find on a nightstand.",No,"There is no bed in the picture. These are dining tables, which are large enough to sit at. Nightstands are usually much smaller than dining tables.",No,The absence of a bed is the main thing that tells one these pieces of furniture are not nightstands.,Neutral,I'm not sure how good the computer will be at identifying relevant similarities and differences.,Strongly Disagree,I feel there must be so many variations possible that that can't be the case.,"The top of the nightstand is usually at the height of the mattress. Nightstands usually won't have chairs pulled up to them. Alarm clocks are a big tip-off for nightstands.",,19,Yes,"Is in bedroom and on side of bed, has books and lamps on it.",Yes,Is in between beds which is also possible.Clock and phone on there which is acceptable.,Yes,nightstand by bed has a lamp and books on it.,No,"Not by a bed, not small drawer.",No,"this is a tv stand, night stands are by beds and in bedrooms usually.",Agree,Told the traits of a nightstand and room usually found in.,Agree,"Got it right in the end, told what not to look for.",none,,20,Yes,There are two nightstands in this picture. Both nightstands are on either side of the bed. There are lamps to help identify the nightstands. Being by the head of the bed is a good indicator of a nightstand.,Yes,There is a lamp above the nightstand. This nightstand is at the head of the beds. Nightstands are usually in between beds like this in hotel rooms. There are bedside items on this nightstand.,Yes,The nightstand is beside the bed. This is usually the case for nightstands. The usually sit against the wall like this also. There is a lamp on the nightstand. That is usually the case for nightstands. There is also a book on the nightstand.,No,This is not a bedroom. A nightstand usually sits by a bed. There are a lot of tables with chairs in this room. This would not be the case for a nightstand. There are a lot of tablecloths on the tables.,No,There is not bed. There is a shelf but it has multiple shelves on it with a lot of items. A nightstand would only have the one surface area on the top for items to be put on it. There are a lot of electronics around.,Agree,I named a lot of things that would allow it to identify nightstands in certain circumstances.,Disagree,There are many times that a nightstand might appear in different ways. Those few pictures didn't cover everything.,Nightstands are usually wood but not always.,,21,Yes,The table that the lamp is on next to the bed is usually considered a nightstand I believe. I believe it is called a night stand because it is beside the bed in the room.,Yes,"The table between the two beds is a nightstand. You can place objects on it. It looks like a drawer, but I think a nightstand can also look like a table.",Yes,The nightstand is the drawer next to the bed with the lamp on it. It is a nightstand because it is next to the bed and you can place objects on it.,Unsure,"Well it depends what is considered a nightstand. There are chairs and tables, as it is a restaurant scene.",Unsure,Sometimes people call that table in front of the television a night stand as well. It really just depends on what you consider a nightstand to be.,Agree,"Nightstand is a pretty vague term, so I'm really not sure.",Neutral,"A nightstand can be considered anything you can out stuff on, so I am really not sure.",That a nightstand is what people perceive a nightstand to be if that makes sense,,22,Yes,There are two nightstands here. The small tables beside the head of the bed with lamps on them are nightstands. In most cases you'll see a lamp on them. They are usually about the same height as the bed and may or may not have drawers or shelves.,Yes,In this picture we have a nightstand sitting between two beds. This is common in hotel rooms. Notice the lamp standing on it and the fact it's about the same height as the mattresses.,Yes,There is a small nightstand on the far side of the bed here. It has a lamp on it and a few books. Notice it's a similar height as the mattress.,No,"again a nightstand goes beside a bed. This picture has tables, if they were much much smaller and beside a bed they might come close to being a nightstand but not as they are here.",No,"A nightstand goes beside a bed, there is no bed in this image and not likely one where the camera is. Also there just nothing here that even comes close to resembling a night stand.",Agree,"because nightstands are very specific, a nightstand next to a couch is not a nightstand, it's an end table. So with the rules i had i think any image similar to those i saw would get flagged by robot.",Neutral,"There are always edge cases, and i can imagine seeing a nightstand by itself might confuse robot because it would be looking for a bed too.",That nightstands can be called different things depending on where they are in a house.,,23,Yes,It is next to a bed. It has right angles. It usually has a lamp on top of it. It often is brown and made of wood.,Yes,There are beds here. There is a brown object between the beds. There is a lamp on top of the brown object. The brown object has right angles. There is a clock on top of the brown object. This appears to be a hotel room or a bedroom.,Yes,There is a bed. There is an object next to the bed. The object is sitting on top of a brown object. There is a lamp on top of the brown object. There is a book on top of the brown object.,No,There is no bed in the photo. There are several round tables covered with white tablecloths. There are several wine glasses on top of the tables. Each table has chairs around it. There is a brick wall. This looks like a restaurant.,No,There is no bed. There is an object with multiple shelves. There is a large screen tv on a wall. There are several electronic items under the tv. This looks like a living room.,Agree,I think I provided enough clues and statements for a computer to eliminate most things that are not a nightstand.,Neutral,I cannot know whether future images will have unexpected things in them that have features in common with a nightstand.,"I haven't taught it what the nightstand is made of or how to tell what it might be made of, other than having right angles and being brown.",,24,Yes,Each piece of furniture beside the bed holding a lamp is a nightstand. It is near enough to the bed that a person doesn't have to get up to turn off the lamp.,Yes,The piece of furniture between the two beds with a lamp and telephone is a nightstand. Usually a clock or clock/radio are present also.,Yes,The small piece of furniture next to the bed holding a lamp is a nightstand.,No,There is no bed next to which a nightstand is placed.,No,There is no bed for a nightstand to be set next to. A nightstand is usually beside a bed within arm's reach.,Agree,"Because nightstands are pretty easy to locate, I think the computer could have learned from my descriptions.",Agree,I think the computer could identify a nightstand because of what I've described.,not sure,,25,Yes,knowing what a nightstand is and using that knowledge plus examples of nightstands I have seen in the past.,Yes,knowing what a nightstand is and using that knowledge plus examples of nightstands I have seen in the past. Nightstands are also found beside beds which are in the photo.,Yes,knowing what a nightstand looks like and comparing ones I have personally seen to what is in the photo.,No,nightstands are commonly found next to beds which there are none of in the photo. Also the only thing in the photo are tables and chairs.,No,"first there is no bed in the picture. second nothing in the photo looks like a nightstand. There is a bookshelf, a multitier shelf with a light and an entertainment stand.",Strongly Agree,i explained what constitutes a night stand,Agree,i explained where nightstands are located,that a nightstand usually has a drawer,,